{
  "$schema": "https://json-schema.org/draft/2020-12/schema",
  "$id": "https://tura.ai/schemas/benchmark/cli-metadata.schema.json",
  "title": "CLI metadata contract",
  "description": "Observed software, agent, release, and launch information for the exact CLI binary used by one run.",
  "type": "object",
  "properties": {
    "schema": {
      "const": "tura.benchmark.cli-metadata.v1",
      "description": "Contract discriminator."
    },
    "software": {
      "type": "object",
      "description": "Host-side package and platform facts.",
      "properties": {
        "platform": {
          "type": "string",
          "description": "Node/runtime platform identifier."
        },
        "arch": { "type": "string", "description": "CPU architecture." },
        "nodeVersion": {
          "type": "string",
          "description": "Node.js version when Node participates in launching or collecting the run; empty when not recorded."
        },
        "systemSoftwareVersion": {
          "type": "string",
          "description": "Human-readable OS/platform version."
        },
        "packageName": {
          "type": "string",
          "description": "Installed CLI package or executable family."
        },
        "packageVersion": {
          "type": "string",
          "description": "Installed CLI package version."
        },
        "gitHead": {
          "type": "string",
          "description": "CLI source commit when the binary was built locally; empty when unavailable."
        }
      },
      "required": ["platform", "arch", "packageName", "packageVersion"],
      "additionalProperties": true
    },
    "agent": {
      "type": "object",
      "description": "Identity and release provenance of the running agent.",
      "properties": {
        "agentId": {
          "type": "string",
          "minLength": 1,
          "description": "Canonical agent or runtime configuration ID."
        },
        "agentName": {
          "type": "string",
          "description": "Human-readable base agent name."
        },
        "agentVersion": {
          "type": "string",
          "description": "Model/version label reported by the agent protocol."
        },
        "agentApplicationVersion": {
          "type": "string",
          "description": "Actual CLI release version obtained from the binary or release artifact."
        },
        "cliLaunchCommandName": {
          "type": "string",
          "description": "Executable name invoked by the benchmark runner."
        },
        "cliCommand": {
          "type": "string",
          "description": "Complete launch command used for reproducibility. Consumers should redact secrets before publication."
        },
        "pluginSkillGithubUrls": {
          "type": "array",
          "description": "GitHub URLs of plugins or skills loaded into this run.",
          "items": { "type": "string", "format": "uri" }
        },
        "githubRepositoryUrl": {
          "type": "string",
          "description": "Canonical source repository for the agent CLI."
        },
        "releasePageUrl": {
          "type": ["string", "null"],
          "description": "Release page corresponding to agentApplicationVersion; null when that release did not publish a stable page."
        },
        "releaseDownloadUrl": {
          "type": ["string", "null"],
          "description": "Exact downloadable binary/archive used when known."
        },
        "releaseSha256": {
          "type": ["string", "null"],
          "description": "SHA-256 of the release artifact; null only when it was not recoverable."
        },
        "model": {
          "type": "string",
          "minLength": 1,
          "description": "Real normalized model ID used by this run."
        },
        "effort": {
          "type": "string",
          "minLength": 1,
          "description": "Real reasoning effort used by this run."
        }
      },
      "required": ["agentId", "agentApplicationVersion", "model", "effort"],
      "additionalProperties": true
    },
    "createdAt": {
      "type": "string",
      "format": "date-time",
      "description": "Time this metadata contract was generated, not necessarily the run start time."
    }
  },
  "required": ["schema", "software", "agent", "createdAt"],
  "additionalProperties": true
}
