{
  "schema": "tura.benchmark.cli-metadata.v1",
  "software": {
    "platform": "win32",
    "arch": "x64",
    "nodeVersion": "v22.15.0",
    "systemSoftwareVersion": "win32/x64 10.0.19045 node v22.15.0",
    "packageName": "tura-ai",
    "packageVersion": "0.1.30",
    "gitHead": "affffbdeea56ea56a8c2c04a2d1ef04f948d2a24"
  },
  "agent": {
    "agentId": "tura-direct",
    "agentName": "Tura Direct",
    "agentVersion": "gpt-5.5",
    "agentApplicationVersion": "0.1.30",
    "cliLaunchCommandName": "runner.mjs",
    "cliCommand": "\"C:\\\\Program Files\\\\nodejs\\\\node.exe\" C:\\Users\\liuliu\\Documents\\tura\\benchmark\\tasks\\rewrite\\source-port-python\\runner.mjs",
    "pluginSkillGithubUrls": [],
    "releaseDownloadUrl": "https://github.com/Tura-AI/tura/releases/download/v0.1.30/tura-v0.1.30-windows-x64.zip",
    "releaseSha256": "857abe35fb52b8ce211b23ae3681cd5abc781cf257ab9685feababc4fea51a52",
    "model": "gpt-5.5",
    "effort": "high",
    "githubRepositoryUrl": "https://github.com/Tura-AI/tura",
    "releasePageUrl": "https://github.com/Tura-AI/tura/releases/tag/v0.1.30"
  },
  "createdAt": "2026-07-09T08:55:11.930Z"
}
