{
  "schema": "tura.benchmark.cli-metadata.v1",
  "software": {
    "platform": "win32",
    "arch": "x64",
    "nodeVersion": "v22.15.0",
    "systemSoftwareVersion": "win32/x64 10.0.19045 node v22.15.0",
    "packageName": "@openai/codex",
    "packageVersion": "(local modified)",
    "gitHead": ""
  },
  "agent": {
    "agentId": "codex-cli",
    "agentName": "Codex CLI",
    "agentVersion": "(local modified)",
    "agentApplicationVersion": "(local modified)",
    "cliLaunchCommandName": "runner.mjs",
    "cliCommand": "\"C:\\\\Program Files\\\\nodejs\\\\node.exe\" C:\\Users\\liuliu\\Documents\\tura\\benchmark\\tasks\\rewrite\\source-port-python\\runner.mjs",
    "pluginSkillGithubUrls": [],
    "releaseDownloadUrl": "https://github.com/openai/codex/releases/download/rust-v0.143.0/codex-x86_64-pc-windows-msvc.exe.zip",
    "releaseSha256": "e0bd59dc95783366471ac523a6993b0989175c8ec2f89f8a88e3f5d21aace027",
    "model": "gpt-5.5",
    "effort": "medium",
    "githubRepositoryUrl": "https://github.com/openai/codex",
    "releasePageUrl": "https://github.com/openai/codex/releases/tag/rust-v0.143.0",
    "versionResolution": "Locally modified Codex CLI build used to capture per-round commands and detailed metadata; not an official release binary."
  },
  "createdAt": "2026-07-08T18:28:39.932Z"
}
